{
 "meta": {
  "slug": "convocatoria_11j",
  "titulo": "Mañana es 11J",
  "subtitulo": "Quinto aniversario de las protestas del 11 de julio de 2021: dónde y a qué hora sale el mundo a la calle por Cuba, y por qué importa que estés.",
  "actualizado": "2026-07-10",
  "evento_fecha": "2026-07-11",
  "modo": "convocatoria",
  "nota_registro": "Esta página es una convocatoria: su objetivo declarado es que mañana haya más gente en la calle. Es un registro distinto al del resto de Yamacoa, que observa y mide sin llamar a nada. Lo que no cambia es la disciplina de fuentes: cada convocatoria muestra su nivel de verificación (confirmada, reportada sin verificar, plausible o especulativa) y cada cifra lleva su fuente y su fecha de corte. Agitar no es excusa para inflar.",
  "fuentes": [
   "CubaNet",
   "Diario Las Américas",
   "Árbol Invertido",
   "14ymedio",
   "CiberCuba",
   "Center for a Free Cuba",
   "Prisoners Defenders",
   "Consorcio Justicia",
   "Justicia 11J",
   "OCDH",
   "Cecilia Bobes (FLACSO México)",
   "Amnistía Internacional",
   "Infobae",
   "El Estornudo",
   "Martí Noticias"
  ],
  "descripcion": "Página especial de convocatoria por el quinto aniversario de las protestas del 11 de julio de 2021 en Cuba. Reúne las manifestaciones convocadas para el 11 de julio de 2026 en ciudades de América y Europa, cada una con su nivel de verificación explícito: cuatro confirmadas por prensa independiente (dos en Miami, una en Madrid y una en Washington D. C.), cuatro reportadas por usuarios sin confirmación independiente de prensa (Montevideo, West New York, West Palm Beach y Barcelona, la segunda y la tercera con volante del convocante), tres plausibles sin confirmar (Houston, Santiago de Chile y Montreal) y dos especulativas (Gijón y un Kornmarkt alemán sin ciudad identificada). Incluye la reconstrucción de la propagación de las protestas originales del 11 y 12 de julio de 2021, desde San Antonio de los Baños hasta más de cincuenta localidades de las quince provincias y la Isla de la Juventud; las cifras de represión al cierre del primer semestre de 2026 según Prisoners Defenders, el Consorcio Justicia, Justicia 11J y el OCDH; el caso de Luis Manuel Otero Alcántara, con condena vencida y paradero desconocido, denunciado como desaparición forzada por Amnistía Internacional; y una primera cohorte nominal de treinta personas que siguen presas o bajo medidas penales cinco años después del 11J.",
  "narracion": "Mañana se cumplen cinco años del once de julio de 2021, el día en que Cuba entera salió a la calle. Este expediente reúne las convocatorias del quinto aniversario en el mundo, cada una con su nivel de verificación explícito: marchas y vigilias confirmadas por prensa independiente en Miami, Madrid y Washington, y convocatorias reportadas o plausibles en Montevideo, West New York, West Palm Beach, Barcelona, Houston, Santiago de Chile y Montreal. El contexto lo da la propia maquinaria: al cierre de junio de 2026, Prisoners Defenders contaba mil trescientos seis presos políticos en Cuba, un récord absoluto; al menos trescientos treinta y ocho siguen vinculados directamente a aquellas protestas, y cuarenta fueron detenidos siendo menores. Y sin embargo la calle no se rinde: el registro de la investigadora Cecilia Bobes cuenta al menos trescientas cuarenta y dos protestas dentro de la isla en lo que va de año, más que en los tres años anteriores juntos. El caso que resume el momento es el del artista Luis Manuel Otero Alcántara, con la condena vencida y el paradero desconocido, denunciado como desaparición forzada por Amnistía Internacional. Si hay una convocatoria cerca de ti, asiste; si no, comparte y verifica antes de difundir. Que mañana nadie pueda decir que no lo sabía.",
  "narracion_en": "Tomorrow marks five years since July eleventh, twenty twenty-one, the day all of Cuba took to the streets. It began in the morning in San Antonio de los Baños, a town in Artemisa, with a Facebook live stream that the regime later punished with six years in prison. Before nightfall the protest had reached Palma Soriano, Havana, Santiago de Cuba, Cárdenas and Pinar del Río; in all, more than fifty towns across the fifteen provinces and the Isle of Youth. They were the largest anti-government protests since nineteen fifty-nine. One man, Diubis Laurencio Tejeda, was killed by a police gunshot in La Güinera. Documented arrests number in the hundreds and, depending on the date of the count, exceed fifteen hundred. Five years on, the machinery is still running. At the close of June twenty twenty-six, Prisoners Defenders counted one thousand three hundred and six political prisoners in Cuban jails, an absolute record; more than two thousand one hundred people have passed through that condition since July eleventh. At least three hundred and thirty-eight of the current prisoners remain directly linked to those protests. Forty people on the current list were minors when detained. In the first half of this year alone there were more than one hundred and seventy-five new political prisoners, and the Cuban Observatory for Human Rights documented at least one thousand nine hundred and forty-nine repressive actions. And yet the street has not surrendered: researcher Cecilia Bobes has recorded at least three hundred and forty-two protests in Cuba so far this year, more than in the previous three years combined. The case that sums up the moment is that of artist Luis Manuel Otero Alcántara: his sentence expired on July ninth, but two days earlier he was taken from Guanajay prison to a location nobody knows. Amnesty International has denounced it as an enforced disappearance. Tomorrow, July eleventh, the diaspora returns to the streets. There are confirmed marches and vigils in Miami, Madrid and Washington; there are reported or plausible calls in Montevideo, West New York, West Palm Beach, Barcelona, Houston, Santiago de Chile and Montreal. This page shows each one with its level of verification, because honesty with sources is the house rule even when the goal is to fill a square. If there is a rally near you, attend. If there is not, share this page, verify before spreading, and stand with those who can go. The comparative evidence is clear: massive, peaceful civil resistance is the path that brings down dictatorships. Five years later, the prisoners' names still have faces. Let no one say tomorrow that they did not know."
 },
 "kpis": [
  {
   "id": "aniversario",
   "valor": "5 años",
   "etiqueta": "del estallido del 11 de julio de 2021"
  },
  {
   "id": "confirmadas",
   "valor": "4",
   "etiqueta": "convocatorias confirmadas para mañana (Miami ×2, Madrid, Washington)",
   "fuente": "prensa independiente, ver mapa"
  },
  {
   "id": "presos11j",
   "valor": "≥338",
   "etiqueta": "presos actuales vinculados directamente al 11J",
   "fuente": "Justicia 11J, jul 2026"
  },
  {
   "id": "protestas2026",
   "valor": "≥342",
   "etiqueta": "protestas en Cuba en lo que va de 2026",
   "fuente": "registro de Cecilia Bobes, FLACSO México"
  }
 ],
 "convocatorias": [
  {
   "id": "miami_cuban_freedom_march",
   "nombre": "Cuban Freedom March: «Acciones, no palabras»",
   "ciudad": "Miami",
   "pais": "Estados Unidos",
   "lugar": "Calle Ocho, desde las inmediaciones de la Casa del Preso",
   "fecha": "2026-07-11",
   "hora_inicio": "17:00",
   "hora_fin": "18:00",
   "tipo": "marcha",
   "organizadores": [
    "Cuban Freedom March",
    "Alián Collazo (director ejecutivo)"
   ],
   "estado": "confirmado",
   "verificacion": "Confirmada por CubaNet y WLRN. Concentración a las 17:00; la marcha en sí arranca hacia las 17:30.",
   "fuente": "https://www.cubanet.org/acciones-no-palabras-convocan-en-miami-una-marcha-por-el-quinto-aniversario-del-11j/",
   "geo": {
    "lat": 25.7656,
    "lon": -80.2264,
    "precision": "ciudad"
   }
  },
  {
   "id": "miami_liberation_day_rally",
   "nombre": "Liberation Day Rally Miami",
   "ciudad": "Miami",
   "pais": "Estados Unidos",
   "lugar": "1444 SW 8th St (frente al Parque del Dominó / Parque Máximo Gómez), La Pequeña Habana",
   "fecha": "2026-07-11",
   "hora_inicio": "18:00",
   "hora_fin": "22:00",
   "tipo": "concentracion",
   "organizadores": [
    "Ciudad de Miami",
    "Comisionado del distrito 3, Miguel Ángel Gabela Escalona",
    "Movimiento Somos+"
   ],
   "estado": "confirmado",
   "verificacion": "Confirmada por Diario Las Américas. Parte de una jornada más amplia de 13:00 a 22:00 con exposiciones y actos culturales cerca del Tower Theater.",
   "fuente": "https://www.diariolasamericas.com/florida/exilio-cubano-marcha-este-sabado-la-pequena-habana-quinto-aniversario-del-11j-n5398619",
   "notas": "Jornada completa desde las 13:00; el acto central va de 18:00 a 22:00.",
   "geo": {
    "lat": 25.7657,
    "lon": -80.2193,
    "precision": "local"
   }
  },
  {
   "id": "madrid_puerta_del_sol",
   "nombre": "Jornada pública «Hoy puede ser un 11J»",
   "ciudad": "Madrid",
   "pais": "España",
   "lugar": "Puerta del Sol",
   "fecha": "2026-07-11",
   "hora_inicio": "14:00",
   "hora_fin": "20:00",
   "tipo": "concentracion",
   "organizadores": [
    "Partido Liberal Clásico Cubano (Amelia Calzadilla)",
    "Disidencias en Movimiento",
    "Somos+"
   ],
   "programa": [
    "Mesas informativas",
    "Intervenciones políticas",
    "Performance «Mi Bandera» (Rafael Vilches, Alberto Lorente, Avana de la Torre), por la tarde",
    "Lectura de poesía a cargo de Rafael Vilches, 18:00",
    "Concierto de cierre de jóvenes cubanos"
   ],
   "estado": "confirmado",
   "verificacion": "Confirmada por Árbol Invertido. El marco general (Puerta del Sol, 14:00 a 20:00) está verificado; los horarios internos del programa varían ligeramente entre fuentes.",
   "fuente": "https://www.arbolinvertido.com/sociedad/jornada-11j-en-madrid-exilio-cubano-celebra-la-rebeldia",
   "geo": {
    "lat": 40.4169,
    "lon": -3.7035,
    "precision": "local"
   }
  },
  {